Rk,Nation,# Players,Min,List,Year
19,pt Portugal,7,6053,Luís Boa Morte Cristiano Ronaldo Hélder Postiga Hugo Viana Silas Ricardo Vaz Tê Filipe Oliveira,2003-2004
20,sn Senegal,6,7774,Henri Camara Amdy Faye El Hadji Diouf Lamine Sakho Aliou Cissé Salif Diao,2003-2004
21,ar Argentina,6,4335,Mauricio Taricco Hernán Crespo Juan Sebastián Verón Facundo Sava Carlos Marinelli Luciano Figueroa,2003-2004
22,tt Trinidad and Tobago,5,8829,Jlloyd Samuel Shaka Hislop Dwight Yorke Stern John Justin Hoyte,2003-2004
23,cm Cameroon,5,7794,Lauren Joseph-Désiré Job Geremi Eric Djemba-Djemba Salomon Olembé,2003-2004
24,za South Africa,5,5632,Mark Fish Quinton Fortune Shaun Bartlett Lucas Radebe Mbulelo Mabizela,2003-2004
25,es Spain,4,6746,Iván Campo Gaizka Mendieta José Antonio Reyes Javi Moreno,2003-2004
26,hr Croatia,4,4241,Igor Bišćan Boris Živković Ivica Mornar Mario Stanić,2003-2004
27,tr Turkey,3,5871,Muzzy Izzet Tugay Kerimoğlu Alpay Özalan,2003-2004
28,is Iceland,3,4980,Hermann Hreiðarsson Eiður Guðjohnsen Joey Guðjónsson,2003-2004
29,cz Czech Republic,3,2076,Vladimír Šmicer Milan Baroš Pavel Srníček,2003-2004
30,ci Ivory Coast,2,4737,Kolo Touré Olivier Tébily,2003-2004
31,sk Slovakia,2,3508,Szilárd Németh Vratislav Greško,2003-2004
32,gr Greece,2,3158,Stelios Giannakopoulos Nikos Dabizas,2003-2004
33,rs Serbia,2,3138,Dejan Stefanović Goran Bunjevčević,2003-2004
34,cn China PR,2,2960,Sun Jihai Li Tie,2003-2004
35,ml Mali,2,2411,Frédéric Kanouté Djimi Traoré,2003-2004
36,ro Romania,2,2398,Adrian Mutu Ionel Ganea,2003-2004
37,uy Uruguay,2,2030,Diego Forlán Gus Poyet,2003-2004
38,ec Ecuador,2,1893,Ulises de la Cruz Agustín Delgado,2003-2004
39,gy Guyana,2,1171,Carl Cort Neil Danns,2003-2004
40,gd Grenada,2,491,Jason Roberts Delroy Facey,2003-2004
41,be Belgium,2,461,Daniel Van Buyten Jonathan Blondel,2003-2004
42,ma Morocco,2,93,Hassan Kachloul Mustapha Hadji,2003-2004
43,co Colombia,1,2770,Juan Pablo Ángel,2003-2004
44,pl Poland,1,2687,Jerzy Dudek,2003-2004
45,bg Bulgaria,1,2585,Radostin Kishishev,2003-2004
46,ca Canada,1,2564,Tomasz Radzinski,2003-2004
47,ru Russia,1,2066,Alexey Smertin,2003-2004
48,pe Peru,1,1655,Nolberto Solano,2003-2004
49,ch Switzerland,1,1401,Stéphane Henchoz,2003-2004
50,jp Japan,1,1295,Junichi Inamoto,2003-2004
51,cr Costa Rica,1,1195,Paulo Wanchope,2003-2004
52,cd Congo DR,1,1165,Lomana LuaLua,2003-2004
53,il Israel,1,961,Eyal Berkovic,2003-2004
54,tg Togo,1,810,Yoann Folly,2003-2004
55,gh Ghana,1,644,Alex Nyarko,2003-2004
56,lv Latvia,1,584,Marians Pahars,2003-2004
57,ua Ukraine,1,392,Oleh Luzhny,2003-2004
58,cy Cyprus,1,91,Alexis Nicolas,2003-2004
59,pk Pakistan,1,1,Zesh Rehman,2003-2004
1,eng England,154,239285,James Beattie Michael Owen Alan Shearer Teddy Sheringham Paul Scholes Danny Murphy Trevor Sinclair Andy Cole Jermain Defoe Frank Lampard ...,2002-2003
2,fr France,36,69341,Thierry Henry Nicolas Anelka Youri Djorkaeff Sylvain Wiltord Steed Malbranque Mikaël Silvestre William Gallas Sylvain Legwinski Fabrice Fernandes Robert Pirès ...,2002-2003
3,ie Ireland,35,55799,Robbie Keane Damien Duff Shay Given Dean Kiely Jeff Kenna Steve Finnan Kevin Kilbane Clinton Morrison Stephen Carr Ian Harte ...,2002-2003
4,sco Scotland,19,21603,David Weir Derek McInnes Paul Telfer Gary Naysmith Paul Devlin Christian Dailly Dominic Matteo Scott Dobie Steven Caldwell Scot Gemmill ...,2002-2003
5,wal Wales,16,26261,Ryan Giggs Simon Davies Robbie Savage Craig Bellamy Jason Koumas Andy Johnson Andy Melville Gary Speed Mark Pembridge Paul Jones ...,2002-2003
6,no Norway,13,20421,John Arne Riise Ole Gunnar Solskjær Claus Lundekvam Eirik Bakke Tore André Flo Ronny Johnsen Øyvind Leonhardsen Henning Berg Jo Tessem Egil Østenstad ...,2002-2003
7,se Sweden,13,17522,Olof Mellberg Michael Svensson Anders Svensson Freddie Ljungberg Nils-Eric Johansson Joachim Björklund Marcus Allbäck Teddy Lučić Mathias Svensson Niclas Alexandersson ...,2002-2003
8,dk Denmark,11,21178,Claus Jensen Thomas Gravesen Per Frandsen Henrik Pedersen Niclas Jensen Peter Schmeichel Jesper Grønkjær Thomas Sørensen Bjarne Goldbæk Stig Tøfting ...,2002-2003
9,nl Netherlands,11,17098,Ruud van Nistelrooy Jimmy Floyd Hasselbaink Dennis Bergkamp Mario Melchiot George Boateng Edwin van der Sar Boudewijn Zenden Giovanni van Bronckhorst Stefan Postma Gerard Wiekens ...,2002-2003
10,au Australia,10,17267,Harry Kewell Mark Viduka Mark Schwarzer Lucas Neill Stan Lazaridis Paul Okon Tony Vidmar Danny Tiatto Luke Wilkshire Jacob Burns,2002-2003
11,nir Northern Ireland,9,15183,Aaron Hughes Damien Johnson Steve Lomas Kevin Horlock Maik Taylor George McCartney Keith Gillespie Roy Carroll Chris Baird,2002-2003
12,jm Jamaica,8,11850,Jason Euell Kevin Lisbie Ricardo Gardner Darren Moore Barry Hayles Michael Johnson Darryl Powell Jermaine Johnson,2002-2003
13,cm Cameroon,6,11681,Marc-Vivien Foé Geremi Joseph-Désiré Job Lauren Pierre Womé Lucien Mettomo,2002-2003
14,it Italy,6,10633,Gianfranco Zola Massimo Maccarone Carlo Cudicini Paolo Di Canio Alessandro Pistone Corrado Grabbi,2002-2003
15,ng Nigeria,6,8017,Jay-Jay Okocha Joseph Yobo Nwankwo Kanu Shola Ameobi Celestine Babayaro Ifeanyi Udeze,2002-2003
16,de Germany,6,6932,Dietmar Hamann Thomas Hitzlsperger Steffen Freund Christian Ziege Robert Huth Markus Babbel,2002-2003
17,ar Argentina,6,5750,Juan Sebastián Verón Mauricio Taricco Facundo Sava Julio Arca Carlos Marinelli Martín Herrera,2002-2003
18,fi Finland,5,12784,Sami Hyypiä Jussi Jääskeläinen Peter Enckelman Antti Niemi Jonatan Johansson,2002-2003
19,us United States,5,8760,Kasey Keller Brad Friedel Brian McBride Claudio Reyna Jovan Kirovski,2002-2003
20,br Brazil,5,5215,Gilberto Silva Edu Gaspar Juninho Paulista Doriva Rodrigo Beckham,2002-2003
21,es Spain,5,4906,Iván Campo Enrique de Lucas Raúl Bravo Albert Ferrer Salva Ballesta,2002-2003
22,pt Portugal,5,3663,Luís Boa Morte Hugo Viana Abel Xavier Ricardo Filipe Oliveira,2002-2003
23,is Iceland,4,7735,Eiður Guðjohnsen Guðni Bergsson Lárus Sigurðsson Joey Guðjónsson,2002-2003
24,tt Trinidad and Tobago,4,7162,Dwight Yorke Jlloyd Samuel Stern John Justin Hoyte,2002-2003
25,za South Africa,4,6086,Shaun Bartlett Mark Fish Lucas Radebe Quinton Fortune,2002-2003
26,cz Czech Republic,4,5274,Tomáš Řepka Milan Baroš Vladimír Šmicer Patrik Berger,2002-2003
27,sn Senegal,4,5052,El Hadji Diouf Aliou Cissé Salif Diao Ferdinand Coly,2002-2003
28,sk Slovakia,4,4707,Igor Bališ Szilárd Németh Vratislav Greško Vladimír Labant,2002-2003
29,tr Turkey,4,3890,Tugay Kerimoğlu Hakan Şükür Alpay Özalan Bülent Akın,2002-2003
30,ma Morocco,4,2395,Abdeslam Ouaddou Talal El Karkouri Mustapha Hadji Tahar El Khalej,2002-2003
31,hr Croatia,3,2407,Mario Stanić Alen Bokšić Igor Bišćan,2002-2003
32,lv Latvia,3,694,Marians Pahars Igors Stepanovs Andrejs Štolcers,2002-2003
33,ml Mali,2,3804,Djimi Traoré Frédéric Kanouté,2002-2003
34,gd Grenada,2,2903,Jason Roberts Delroy Facey,2002-2003
35,pl Poland,2,2738,Jerzy Dudek Piotr Świerczewski,2002-2003
36,uy Uruguay,2,2697,Gus Poyet Diego Forlán,2002-2003
37,be Belgium,2,2433,Nico Vaesen Jonathan Blondel,2002-2003
38,dz Algeria,2,2389,Ali Benarbia Djamel Belmadi,2002-2003
39,cn China PR,2,2315,Sun Jihai Li Tie,2002-2003
40,ci Ivory Coast,2,1870,Kolo Touré Olivier Tébily,2002-2003
41,ec Ecuador,2,1434,Ulises de la Cruz Agustín Delgado,2002-2003
42,gr Greece,2,1159,Nikos Dabizas Stathis Tavlaridis,2002-2003
43,jp Japan,2,992,Junichi Inamoto Kazuyuki Toda,2002-2003
44,gy Guyana,2,49,Neil Danns Carl Cort,2002-2003
45,rs Serbia,1,2747,Goran Bunjevčević,2002-2003
46,ca Canada,1,2309,Tomasz Radzinski,2002-2003
47,pe Peru,1,2295,Nolberto Solano,2002-2003
48,bg Bulgaria,1,2206,Radostin Kishishev,2002-2003
49,il Israel,1,2162,Eyal Berkovic,2002-2003
50,ch Switzerland,1,1615,Stéphane Henchoz,2002-2003
51,bm Bermuda,1,1315,Shaun Goater,2002-2003
52,at Austria,1,1143,Jürgen Macho,2002-2003
53,ua Ukraine,1,1064,Oleh Luzhny,2002-2003
54,co Colombia,1,737,Juan Pablo Ángel,2002-2003
55,si Slovenia,1,494,Milenko Ačimovič,2002-2003
56,cd Congo DR,1,489,Lomana LuaLua,2002-2003
57,gh Ghana,1,404,Elvis Hammond,2002-2003
58,ee Estonia,1,360,Mart Poom,2002-2003
59,cl Chile,1,150,Clarence Acuña,2002-2003
60,gn Guinea,1,62,Titi Camara,2002-2003
61,kn Saint Kitts and Nevis,1,52,Calum Willock,2002-2003
62,xc Commonwealth of Independent States,1,34,Andrei Kanchelskis,2002-2003
1,eng England,152,252500,Alan Shearer Kevin Phillips Matt Jansen Michael Owen Darius Vassell Teddy Sheringham David Beckham Frank Lampard Trevor Sinclair Danny Murphy ...,2001-2002
2,fr France,37,61026,Thierry Henry Laurent Robert Robert Pirès Steed Malbranque Sylvain Wiltord Louis Saha Sébastien Schemmel Patrick Vieira Mikaël Silvestre Sylvain Legwinski ...,2001-2002
3,ie Ireland,30,44687,Ian Harte Matt Holland Damien Duff Steve Finnan Shay Given Dean Kiely Roy Keane Andy O'Brien Steve Staunton Niall Quinn ...,2001-2002
4,sco Scotland,22,37638,David Weir Christian Dailly Scot Gemmill Matt Elliott Callum Davidson John Collins Dominic Matteo Paul Telfer Neil Sullivan Robbie Stockdale ...,2001-2002
5,wal Wales,15,23872,Ryan Giggs Robbie Savage Paul Jones Gary Speed Andy Melville Mark Delaney John Robinson Simon Davies Mark Crossley Mark Pembridge ...,2001-2002
6,nl Netherlands,13,23254,Jimmy Floyd Hasselbaink Ruud van Nistelrooy Dennis Bergkamp George Boateng Mario Melchiot Edwin van der Sar Martijn Reuser Boudewijn Zenden Giovanni van Bronckhorst Fabian Wilnis ...,2001-2002
7,no Norway,12,18453,Ole Gunnar Solskjær John Arne Riise Henning Berg Claus Lundekvam Eirik Bakke Stig Inge Bjørnebye Steffen Iversen Jo Tessem Ronny Johnsen Øyvind Leonhardsen ...,2001-2002
8,dk Denmark,12,15587,Thomas Sørensen Per Frandsen Peter Schmeichel Thomas Gravesen Claus Jensen Jesper Grønkjær Bo Hansen Jacob Laursen Bjarne Goldbæk Henrik Pedersen ...,2001-2002
9,it Italy,11,18521,Fabrizio Ravanelli Paolo Di Canio Benito Carbone Carlo Cudicini Gianfranco Zola Alessandro Pistone Samuele Dalla Bona Matteo Sereni Corrado Grabbi Gianluca Festa ...,2001-2002
10,se Sweden,10,15456,Anders Svensson Freddie Ljungberg Niclas Alexandersson Olof Mellberg Stefan Schwarz Nils-Eric Johansson Joachim Björklund Jesper Blomqvist Mathias Svensson Tobias Linderoth,2001-2002
11,au Australia,10,11233,Mark Viduka Harry Kewell Lucas Neill Mark Schwarzer Luke Wilkshire Mark Bosnich Hayden Foxe Paul Okon Richard Garcia Scott McDonald,2001-2002
12,nir Northern Ireland,10,9613,Aaron Hughes Keith Gillespie Jim Magilton Steve Lomas Roy Carroll Damien Johnson George McCartney Maik Taylor Grant McCann Gerry Taggart,2001-2002
13,jm Jamaica,9,15668,Jason Euell Barry Hayles Frank Sinclair Ricardo Gardner Darryl Powell Kevin Lisbie Deon Burton Trevor Benjamin Jermaine Johnson,2001-2002
14,ar Argentina,8,11506,Juan Sebastián Verón Mauricio Taricco Julio Arca Luciano Zavagno Sixto Peralta Carlos Marinelli Horacio Carbonari Christian Bassedas,2001-2002
15,fi Finland,7,10995,Sami Hyypiä Jussi Jääskeläinen Jonatan Johansson Jari Litmanen Mikael Forssell Peter Enckelman Simo Valakari,2001-2002
16,de Germany,6,8188,Christian Ziege Dietmar Hamann Steffen Freund Fredi Bobic Uwe Rösler Markus Babbel,2001-2002
17,us United States,6,6383,Brad Friedel Claudio Reyna Joe-Max Moore Kasey Keller Ian Feuer Eddie Lewis,2001-2002
18,ng Nigeria,5,6000,Finidi George Ade Akinbiyi Celestine Babayaro Nwankwo Kanu Shola Ameobi,2001-2002
19,is Iceland,4,8332,Eiður Guðjohnsen Hermann Hreiðarsson Guðni Bergsson Arnar Gunnlaugsson,2001-2002
20,tr Turkey,4,7360,Tugay Kerimoğlu Muzzy Izzet Alpay Özalan Hakan Ünsal,2001-2002
21,ma Morocco,4,4408,Mustapha Hadji Hassan Kachloul Tahar El Khalej Abdeslam Ouaddou,2001-2002
22,hr Croatia,4,3770,Alen Bokšić Mario Stanić Igor Bišćan Boško Balaban,2001-2002
23,cm Cameroon,4,3590,Lauren Patrick M'Boma Rigobert Song Joseph-Désiré Job,2001-2002
24,cz Czech Republic,3,5226,Tomáš Řepka Vladimír Šmicer Patrik Berger,2001-2002
25,pt Portugal,3,5040,Jorge Costa Abel Xavier Luís Boa Morte,2001-2002
26,za South Africa,3,3601,Mark Fish Shaun Bartlett Quinton Fortune,2001-2002
27,lv Latvia,3,3355,Marians Pahars Igors Stepanovs Andrejs Štolcers,2001-2002
28,tt Trinidad and Tobago,3,3159,Jlloyd Samuel Shaka Hislop Dwight Yorke,2001-2002
29,sk Slovakia,3,2460,Szilárd Németh Vladimír Labant Stanislav Varga,2001-2002
30,ch Switzerland,2,5689,Stéphane Henchoz Bernt Haas,2001-2002
31,gr Greece,2,3078,Nikos Dabizas Kostas Konstantinidis,2001-2002
32,uy Uruguay,2,2869,Gus Poyet Diego Forlán,2001-2002
33,co Colombia,2,2696,Juan Pablo Ángel Hamilton Ricard,2001-2002
34,ua Ukraine,2,2302,Oleh Luzhny Serhiy Rebrov,2001-2002
35,br Brazil,2,1776,Emerson Thome Edu Gaspar,2001-2002
36,es Spain,2,607,Pablo Couñago Albert Ferrer,2001-2002
37,bg Bulgaria,2,235,Svetoslav Todorov Radostin Kishishev,2001-2002
38,pe Peru,1,3158,Nolberto Solano,2001-2002
39,pl Poland,1,3115,Jerzy Dudek,2001-2002
40,ml Mali,1,2196,Frédéric Kanouté,2001-2002
41,ca Canada,1,2106,Tomasz Radzinski,2001-2002
42,ee Estonia,1,1472,Mart Poom,2001-2002
43,cg Congo,1,1469,Youl Mawéné,2001-2002
44,ge Georgia,1,1398,Georgi Kinkladze,2001-2002
45,cl Chile,1,978,Clarence Acuña,2001-2002
46,be Belgium,1,666,Branko Strupar,2001-2002
47,cd Congo DR,1,584,Lomana LuaLua,2001-2002
48,gy Guyana,1,446,Carl Cort,2001-2002
49,rs Serbia,1,417,Goran Bunjevčević,2001-2002
50,at Austria,1,360,Jürgen Macho,2001-2002
51,il Israel,1,192,Idan Tal,2001-2002
52,ec Ecuador,1,65,Agustín Delgado,2001-2002
53,ro Romania,1,55,Dan Petrescu,2001-2002
54,sc Seychelles,1,6,Kevin Betsy,2001-2002
1,eng England,174,274381,Kevin Phillips David Beckham Lee Bowyer Paul Merson Emile Heskey Graham Stuart Alan Smith Teddy Sheringham Dennis Wise Steve Howey ...,2000-2001
2,sco Scotland,34,42544,Don Hutchison David Weir Stuart McCall Matt Elliott Neil Sullivan Gary McAllister Paul Telfer Dominic Matteo Scot Gemmill Craig Burley ...,2000-2001
3,ie Ireland,30,52433,Matt Holland Ian Harte Niall Quinn Rory Delap Roy Keane Shay Given Kevin Kilbane Stephen Carr Mark Kinsella Gary Breen ...,2000-2001
4,fr France,23,36125,Thierry Henry Patrick Vieira Robert Pirès Olivier Dacourt Christian Karembeu Marcel Desailly Sylvain Wiltord Fabien Barthez Gilles Grimandi Laurent Charvet ...,2000-2001
5,no Norway,17,20482,Alf-Inge Håland Claus Lundekvam Ole Gunnar Solskjær Jo Tessem Øyvind Leonhardsen Eirik Bakke Steffen Iversen Bjørn Otto Bragstad Tore André Flo Gunnar Halle ...,2000-2001
6,nl Netherlands,16,25077,Jimmy Floyd Hasselbaink Sander Westerveld Gerard Wiekens Mario Melchiot George Boateng Fabian Wilnis Dennis Bergkamp Martijn Reuser Robert Molenaar Jaap Stam ...,2000-2001
7,wal Wales,15,21551,Gary Speed Ryan Giggs Robbie Savage Paul Jones John Robinson Mark Pembridge John Hartson Mark Delaney Simon Davies Matt Jones ...,2000-2001
8,nir Northern Ireland,12,16666,Jim Magilton Aaron Hughes Jeff Whitley Gerry Taggart Steve Lomas Neil Lennon Ian Nolan Kevin Horlock Owen Morrison Aidan Davison ...,2000-2001
9,it Italy,11,18048,Paolo Di Canio Gianfranco Zola Benito Carbone Samuele Dalla Bona Stefano Eranio Carlo Cudicini Gianluca Festa Roberto Di Matteo Christian Panucci Alessandro Pistone ...,2000-2001
10,au Australia,11,14495,Mark Viduka Danny Tiatto Mark Schwarzer Paul Okon Harry Kewell John Aloisi Saša Ilić Hayden Foxe Jacob Burns Con Blatsis ...,2000-2001
11,de Germany,8,9591,Markus Babbel Dietmar Hamann Steffen Freund Christian Ziege Uwe Rösler Stefan Schnoor Stefan Malz Thomas Hitzlsperger,2000-2001
12,jm Jamaica,7,9138,Deon Burton Darryl Powell Jamie Lawrence Frank Sinclair Trevor Benjamin David Johnson Kevin Lisbie,2000-2001
13,se Sweden,7,8022,Freddie Ljungberg Mathias Svensson Stefan Schwarz Niclas Alexandersson Magnus Hedman Martin Pringle Bojan Djordjic,2000-2001
14,ar Argentina,7,7983,Julio Arca Horacio Carbonari Christian Bassedas Daniel Cordone Nelson Vivas Carlos Marinelli Mauricio Taricco,2000-2001
15,ng Nigeria,5,8513,Ade Akinbiyi Celestine Babayaro Nwankwo Kanu Taribo West Shola Ameobi,2000-2001
16,fi Finland,5,7275,Jonatan Johansson Sami Hyypiä Simo Valakari Jari Litmanen Hannu Tihinen,2000-2001
17,za South Africa,5,5699,Shaun Bartlett Mark Fish Lucas Radebe Quinton Fortune Paul Evans,2000-2001
18,hr Croatia,5,5603,Alen Bokšić Igor Štimac Davor Šuker Mario Stanić Igor Bišćan,2000-2001
19,dk Denmark,4,9527,Claus Jensen Thomas Gravesen Thomas Sørensen Jesper Grønkjær,2000-2001
20,ma Morocco,4,8882,Hassan Kachloul Mustapha Hadji Tahar El Khalej Youssef Chippo,2000-2001
21,is Iceland,4,5516,Hermann Hreiðarsson Eiður Guðjohnsen Arnar Gunnlaugsson Þórður Guðjónsson,2000-2001
22,be Belgium,4,2082,Branko Strupar Cédric Roussel Gilles De Bilde Luc Nilis,2000-2001
23,br Brazil,3,4981,Emerson Thome Sylvinho Edu Gaspar,2000-2001
24,tt Trinidad and Tobago,3,4590,Shaka Hislop Dwight Yorke Jlloyd Samuel,2000-2001
25,cm Cameroon,3,3830,Rigobert Song Lauren Joseph-Désiré Job,2000-2001
26,lv Latvia,3,3155,Marians Pahars Igors Stepanovs Imants Bleidelis,2000-2001
27,tr Turkey,2,5092,Muzzy Izzet Alpay Özalan,2000-2001
28,ua Ukraine,2,3825,Serhiy Rebrov Oleh Luzhny,2000-2001
29,ch Switzerland,2,3612,Stéphane Henchoz Ramon Vega,2000-2001
30,pe Peru,2,3375,Nolberto Solano Ysrael Zúñiga,2000-2001
31,ml Mali,2,3356,Frédéric Kanouté Djimi Traoré,2000-2001
32,bg Bulgaria,2,2517,Radostin Kishishev Svetoslav Todorov,2000-2001
33,cz Czech Republic,2,2405,Vladimír Šmicer Patrik Berger,2000-2001
34,co Colombia,2,2296,Hamilton Ricard Juan Pablo Ángel,2000-2001
35,cl Chile,2,2216,Clarence Acuña Javier Margas,2000-2001
36,es Spain,2,1452,Albert Ferrer Marcelino Elena,2000-2001
37,at Austria,2,1392,Alex Manninger Jürgen Macho,2000-2001
38,ge Georgia,2,1384,Georgi Kinkladze Rati Aleksidze,2000-2001
39,us United States,2,1140,Joe-Max Moore Steve Potts,2000-2001
40,gn Guinea,2,970,Kaba Diawara Titi Camara,2000-2001
41,pt Portugal,2,906,Abel Xavier José Dominguez,2000-2001
42,ca Canada,2,373,Craig Forrest Terry Dunfield,2000-2001
43,ee Estonia,1,2960,Mart Poom,2000-2001
44,cr Costa Rica,1,2203,Paulo Wanchope,2000-2001
45,uy Uruguay,1,2017,Gus Poyet,2000-2001
46,ro Romania,1,1965,Dan Petrescu,2000-2001
47,bm Bermuda,1,1747,Shaun Goater,2000-2001
48,gh Ghana,1,1665,Alex Nyarko,2000-2001
49,il Israel,1,1119,Idan Tal,2000-2001
50,gy Guyana,1,1098,Carl Cort,2000-2001
51,sk Slovakia,1,811,Stanislav Varga,2000-2001
52,gr Greece,1,765,Nikos Dabizas,2000-2001
53,yu Yugoslavia,1,761,Slaviša Jokanović,2000-2001
54,xc Commonwealth of Independent States,1,678,Andrei Kanchelskis,2000-2001
55,cd Congo DR,1,582,Lomana LuaLua,2000-2001
56,ba Bosnia and Herzegovina,1,579,Muhamed Konjić,2000-2001
57,cg Congo,1,578,Youl Mawéné,2000-2001
58,lr Liberia,1,475,George Weah,2000-2001
59,nz New Zealand,1,299,Danny Hay,2000-2001
60,hn Honduras,1,227,Iván Guerrero,2000-2001
61,lt Lithuania,1,37,Tomas Danilevičius,2000-2001
62,ir Iran,1,18,Karim Bagheri,2000-2001
63,py Paraguay,1,5,Diego Gavilán,2000-2001
1,eng England,170,264385,Kevin Phillips Alan Shearer Carlton Palmer Nick Barmby David Beckham Trevor Sinclair Michael Bridges Andy Cole Frank Lampard Kevin Campbell ...,1999-2000
2,ie Ireland,29,48021,Niall Quinn Rory Delap Robbie Keane Ian Harte Stephen Carr Kenny Cunningham Andy O'Brien Roy Keane Thomas Butler Gary Kelly ...,1999-2000
3,sco Scotland,29,43120,Gary McAllister Matt Elliott Don Hutchison David Weir Neil Sullivan Stuart McCall John Collins Dominic Matteo Richard Gough Alex Rae ...,1999-2000
4,no Norway,22,30857,Steffen Iversen Gunnar Halle Trond Andersen Ole Gunnar Solskjær Tore André Flo Eirik Bakke Claus Lundekvam Jo Tessem Øyvind Leonhardsen Trond Egil Soltvedt ...,1999-2000
5,fr France,21,32145,Thierry Henry David Ginola Patrick Vieira Emmanuel Petit Mikaël Silvestre Frank Leboeuf Gilles Grimandi Didier Domi Didier Deschamps Marcel Desailly ...,1999-2000
6,wal Wales,18,29230,Gary Speed Ryan Giggs Rob Page Mark Pembridge Robbie Savage Mark Hughes Dean Saunders Paul Jones Mark Delaney John Hartson ...,1999-2000
7,nl Netherlands,15,24192,Wim Jonk Ed de Goey Marc Overmars Sander Westerveld Dennis Bergkamp Jaap Stam George Boateng Gerald Sibon Nordin Wooter Raimond van der Gouw ...,1999-2000
8,it Italy,12,15147,Paolo Di Canio Gianfranco Zola Benito Carbone Gianluca Festa Roberto Di Matteo Stefano Eranio Alessandro Pistone Gabriele Ambrosetti Francesco Baiano Massimo Taibi ...,1999-2000
9,nir Northern Ireland,11,18867,Neil Lennon Gerry Taggart Ian Nolan Steve Lomas Aaron Hughes Peter Kennedy Mark Williams Danny Sonner Michael Hughes Aidan Davison ...,1999-2000
10,jm Jamaica,9,19759,Marcus Gayle Jason Euell Micah Hyde Darryl Powell Frank Sinclair Robbie Earle Jamie Lawrence Deon Burton Damien Francis,1999-2000
11,de Germany,7,9239,Christian Ziege Dietmar Hamann Steffen Freund Stefan Schnoor Stefan Malz Thomas Helmer Karl-Heinz Riedle,1999-2000
12,dk Denmark,7,8457,Thomas Sørensen Jacob Laursen Mikkel Beck Jes Høgh Allan Nielsen Bjarne Goldbæk Carsten Fredgaard,1999-2000
13,pt Portugal,7,3593,Abel Xavier Hélder Luís Boa Morte José Dominguez Jorge Cadete Dani Rodrigues Marco Almeida,1999-2000
14,au Australia,6,10576,Harry Kewell Mark Schwarzer Richard Johnson Mark Bosnich John Aloisi Saša Ilić,1999-2000
15,se Sweden,5,11119,Niclas Alexandersson Magnus Hedman Stefan Schwarz Freddie Ljungberg Tomas Antonelius,1999-2000
16,ar Argentina,5,5964,Mauricio Taricco Horacio Carbonari Esteban Fuertes Nelson Vivas Carlos Marinelli,1999-2000
17,ma Morocco,4,9117,Mustapha Hadji Youssef Chippo Hassan Kachloul Tahar El Khalej,1999-2000
18,br Brazil,4,7537,Emerson Thome Juninho Paulista Sylvinho Pilo,1999-2000
19,be Belgium,4,5833,Gilles De Bilde Cédric Roussel Branko Strupar Adrian Bakalli,1999-2000
20,is Iceland,4,3758,Hermann Hreiðarsson Heiðar Helguson Jóhann Berg Guðmundsson Arnar Gunnlaugsson,1999-2000
21,us United States,4,2842,Joe-Max Moore Steve Potts Ian Feuer Brad Friedel,1999-2000
22,cz Czech Republic,3,5819,Patrik Berger Pavel Srníček Vladimír Šmicer,1999-2000
23,tt Trinidad and Tobago,3,4993,Dwight Yorke Shaka Hislop Jlloyd Samuel,1999-2000
24,gr Greece,3,3920,Nikos Dabizas Theodoros Zagorakis Vassilios Borbokis,1999-2000
25,hr Croatia,3,3477,Igor Štimac Davor Šuker Silvio Marić,1999-2000
26,il Israel,3,1418,Walid Badir Avi Nimni Najwan Ghrayib,1999-2000
27,fi Finland,2,4225,Sami Hyypiä Peter Enckelman,1999-2000
28,ng Nigeria,2,4216,Nwankwo Kanu Celestine Babayaro,1999-2000
29,cm Cameroon,2,3520,Marc-Vivien Foé Rigobert Song,1999-2000
30,za South Africa,2,3068,Lucas Radebe Quinton Fortune,1999-2000
31,es Spain,2,2979,Albert Ferrer Marcelino Elena,1999-2000
32,ch Switzerland,2,2829,Stéphane Henchoz Ramon Vega,1999-2000
33,pe Peru,2,2730,Nolberto Solano Ysrael Zúñiga,1999-2000
34,ge Georgia,2,2469,Georgi Kinkladze Temur Ketsbaia,1999-2000
35,at Austria,2,1320,Alex Manninger Martin Hiden,1999-2000
36,cr Costa Rica,1,2932,Paulo Wanchope,1999-2000
37,gy Guyana,1,2869,Carl Cort,1999-2000
38,lv Latvia,1,2778,Marians Pahars,1999-2000
39,tr Turkey,1,2688,Muzzy Izzet,1999-2000
40,ee Estonia,1,2520,Mart Poom,1999-2000
41,co Colombia,1,2361,Hamilton Ricard,1999-2000
42,uy Uruguay,1,2347,Gus Poyet,1999-2000
43,ro Romania,1,1989,Dan Petrescu,1999-2000
44,gn Guinea,1,1977,Titi Camara,1999-2000
45,ua Ukraine,1,1508,Oleh Luzhny,1999-2000
46,cd Congo DR,1,1343,Michel Ngonge,1999-2000
47,cl Chile,1,1340,Javier Margas,1999-2000
48,ca Canada,1,937,Craig Forrest,1999-2000
49,lr Liberia,1,876,George Weah,1999-2000
50,ml Mali,1,720,Frédéric Kanouté,1999-2000
51,ba Bosnia and Herzegovina,1,243,Muhamed Konjić,1999-2000
52,py Paraguay,1,212,Diego Gavilán,1999-2000
53,ms Montserrat,1,98,Ruel Fox,1999-2000
1,eng England,174,282555,Steve Guppy Michael Owen Julian Joachim David Beckham Frank Lampard Andy Cole Dion Dublin Darren Anderton Alan Shearer Jamie Redknapp ...,1998-1999
2,sco Scotland,32,44837,Matt Elliott Don Hutchison David Hopkin Neil Sullivan Callum Davidson Gary McAllister Paul Telfer Dougie Freedman Scot Gemmill Duncan Ferguson ...,1998-1999
3,fr France,27,34449,Nicolas Anelka David Ginola Patrick Vieira Frank Leboeuf Emmanuel Petit Laurent Charvet Olivier Dacourt Marcel Desailly Thierry Bonalair Marc Keller ...,1998-1999
4,ie Ireland,26,45559,Ian Harte Mark Kinsella Stephen Carr Andy Townsend Kenny Cunningham Roy Keane Shay Given Denis Irwin Lee Carsley Steve Staunton ...,1998-1999
5,no Norway,20,34907,Petter Rudi Thomas Myhre Egil Østenstad Tore André Flo Steffen Iversen Lars Bohinen Claus Lundekvam Vegard Heggem Alf-Inge Håland Trond Egil Soltvedt ...,1998-1999
6,wal Wales,17,22736,Gary Speed John Hartson Ben Thatcher Paul Jones John Robinson Robbie Savage Ryan Giggs Nathan Blake Mark Crossley Ceri Hughes ...,1998-1999
7,it Italy,17,19858,Gianfranco Zola Benito Carbone Roberto Di Matteo Gianluca Festa Paolo Di Canio Marco Materazzi Stefano Eranio Francesco Baiano Gianluca Vialli Pierluigi Casiraghi ...,1998-1999
8,nl Netherlands,15,27204,Jimmy Floyd Hasselbaink Dennis Bergkamp Marc Overmars Wim Jonk George Boateng Ed de Goey Jaap Stam Pierre van Hooijdonk Ken Monkou Robert Molenaar ...,1998-1999
9,nir Northern Ireland,10,15808,Neil Lennon Michael Hughes Steve Lomas Danny Sonner Keith Gillespie Damien Johnson Aaron Hughes Gerry Taggart Alan Fettis Jim Magilton,1998-1999
10,se Sweden,10,15133,Magnus Hedman Niclas Alexandersson Roland Nilsson Jesper Blomqvist Martin Pringle Pontus Kåmark Andreas Andersson Freddie Ljungberg Jesper Mattsson Martin Dahlin,1998-1999
11,au Australia,9,14265,Harry Kewell Mark Schwarzer John Filan Saša Ilić John Aloisi Mark Bosnich Stan Lazaridis Andy Petterson Chris Coyne,1998-1999
12,jm Jamaica,8,17498,Marcus Gayle Robbie Earle Jason Euell Darryl Powell Frank Sinclair Michael Johnson Deon Burton Kevin Lisbie,1998-1999
13,dk Denmark,7,12239,Jacob Laursen Peter Schmeichel Allan Nielsen Mikkel Beck Bjarne Goldbæk Brian Laudrup Peter Degn,1998-1999
